{
  "id": "copywriter",
  "name": {
    "default": "Copywriter",
    "zh": "文案生成",
    "ja": "コピー生成"
  },
  "description": {
    "default": "Generate product copy: name + selling points + audience → 3 candidates.",
    "zh": "商品文案：名称 / 卖点 / 受众 → 3 条候选。",
    "ja": "商品コピー：名前 / 売り / 対象 → 3 案。"
  },
  "version": "1.0.0",
  "renderer": "auto",
  "author": "agent-rt",
  "category": "utilities",
  "keywords": [
    "copywriting",
    "llm",
    "marketing"
  ],
  "icon": "https://api.iconify.design/ph/megaphone-fill.svg?color=%23ef6f5f&width=256",
  "permissions": [
    "data:read",
    "data:write"
  ],
  "window": {
    "style": "phone",
    "width": 460,
    "height": 760
  },
  "scripts": null,
  "state": {
    "endpoint": "http://10.0.0.64:8800/v1/chat/completions",
    "model": "unsloth/gemma-4-26B-A4B-it-GGUF:gemma-4-26B-A4B-it-UD-Q4_K_M",
    "output": "",
    "loading": false,
    "error": ""
  },
  "collections": {
    "scratch": {
      "schema": {
        "name": {
          "type": "string"
        }
      }
    },
    "history": {
      "schema": {
        "name": {
          "type": "string"
        },
        "selling_points": {
          "type": "string"
        },
        "audience": {
          "type": "string"
        },
        "platform": {
          "type": "string"
        },
        "tone": {
          "type": "string"
        },
        "output": {
          "type": "string"
        },
        "model": {
          "type": "string"
        },
        "created_at": {
          "type": "string"
        }
      },
      "indexes": [
        "tone",
        "created_at"
      ]
    }
  }
}
