{
  "id": "tip",
  "name": {
    "default": "Tip Split",
    "zh": "小费分账",
    "ja": "チップ計算"
  },
  "description": {
    "default": "Bill + tip% + split — derived totals via spec math directive, no scripts.",
    "zh": "账单 + 小费 + 分摊 —— 走 spec math 指令计算，不需 scripts。",
    "ja": "請求額 + チップ + 人数割り。"
  },
  "version": "0.1.0",
  "renderer": "auto",
  "default_locale": "en",
  "category": "utilities",
  "permissions": [],
  "window": {
    "style": "phone",
    "width": 360,
    "height": 560
  },
  "state": {
    "bill": 50,
    "tipPct": 15,
    "splitN": 1
  }
}
