{
  "id": "gallery",
  "name": {
    "default": "Components",
    "zh": "组件库",
    "ja": "コンポーネント"
  },
  "description": {
    "default": "Visual gallery of every Aglet UI component × states/variants — the web-renderer design acceptance surface.",
    "zh": "Aglet 全部 UI 组件 × 状态/变体的可视化展廊 —— web renderer 设计验收台。",
    "ja": "Aglet の全 UI コンポーネント × 状態/バリアントの一覧 —— web renderer デザイン検収台。"
  },
  "version": "0.1.0",
  "renderer": "web",
  "permissions": [],
  "author": "agent-rt",
  "category": "developer-tools",
  "keywords": [
    "gallery",
    "components",
    "design",
    "showcase",
    "dogfood"
  ],
  "icon": "https://api.iconify.design/ph/swatches-fill.svg?color=%233a6ea5&width=256",
  "window": {
    "style": "desktop",
    "width": 940,
    "height": 780
  },
  "collections": {
    "demo": {
      "storage": "memory",
      "schema": {
        "name": {
          "type": "string"
        },
        "bio": {
          "type": "string"
        },
        "qty": {
          "type": "integer"
        },
        "fruit": {
          "type": "string"
        },
        "city": {
          "type": "string"
        },
        "notify": {
          "type": "boolean"
        },
        "agree": {
          "type": "boolean"
        },
        "plan": {
          "type": "string"
        },
        "volume": {
          "type": "integer"
        },
        "due": {
          "type": "string"
        }
      }
    }
  }
}
