{
  "id": "reader",
  "name": {
    "default": "Reader",
    "en": "Reader",
    "zh": "阅读器",
    "ja": "リーダー"
  },
  "description": {
    "default": "URL → markdown + AI summary, kept locally.",
    "en": "URL → markdown + AI summary, kept locally.",
    "zh": "把网页转 markdown + AI 总结，存本地。",
    "ja": "URL を Markdown + AI 要約に変換しローカル保存。"
  },
  "docs": "# Reader\n\n输入一个 URL，aglet 调用 `mdctl` 抓页面 markdown、`llmctl` 写一段总结，存进 `articles` 表里。失败的 URL（mdctl 非 0 退出 / 抓不到内容）直接丢弃不入库。\n\n## 工作流\n\n1. UI 顶部 Input 填 URL，点 \"Fetch\" → 在 `queue` 表写一行 {url}\n2. ⌘R 或 toolbar Reload → 触发 `aglet ingest reader`：\n   ```sh\n   # 对每条 queue.url:\n   md=$(mdctl <url>)            # 失败 → 跳过本条，删 queue 行\n   summary=$(llmctl --buffer < md)\n   # 成功 → data.create articles + data.delete queue\n   ```\n3. 历史在 articles 表，DataList 倒序展示\n4. 点 \"Read\" 打开 Drawer 看完整 markdown\n\n## 失败语义\n\n- mdctl exit != 0 → 直接 data.delete queue 行，不写 articles\n- 同一 url 多次抓 → 旧 article 保留，新 article 各自 row（按 fetched_at 排）\n",
  "version": "1.0.0",
  "renderer": "auto",
  "author": "agent-rt",
  "category": "productivity",
  "keywords": [
    "reader",
    "markdown",
    "summarize",
    "agent"
  ],
  "icon": "https://api.iconify.design/ph/book-open-fill.svg?color=%231a73e8&width=256",
  "permissions": [
    "data:read",
    "data:write",
    "notifications:post"
  ],
  "window": {
    "style": "phone",
    "width": 480,
    "height": 880
  },
  "jobs": [
    {
      "id": "ingest",
      "trigger": {
        "kind": "interval",
        "ms": 60000
      },
      "while": "always",
      "handler": "ingest"
    }
  ],
  "collections": {
    "articles": {
      "schema": {
        "url": {
          "type": "string"
        },
        "title": {
          "type": "string"
        },
        "domain": {
          "type": "string"
        },
        "summary": {
          "type": "string"
        },
        "content": {
          "type": "string"
        },
        "fetched_at": {
          "type": "number"
        }
      },
      "indexes": [
        "fetched_at",
        "domain"
      ]
    },
    "queue": {
      "schema": {
        "url": {
          "type": "string"
        },
        "created_at": {
          "type": "number"
        }
      },
      "indexes": [
        "created_at"
      ]
    }
  },
  "state": {
    "activeId": ""
  }
}
