{
  "id": "fx",
  "name": {
    "default": "FX & Profit",
    "zh": "汇率利润",
    "ja": "為替損益"
  },
  "description": {
    "default": "Currency conversion + landed-cost / profit margin calculator.",
    "zh": "汇率换算 + 到岸成本 / 利润率计算。",
    "ja": "為替換算と仕入原価・利益率の計算。"
  },
  "version": "1.0.0",
  "renderer": "auto",
  "author": "agent-rt",
  "category": "utilities",
  "keywords": [
    "currency",
    "fx",
    "profit",
    "margin"
  ],
  "icon": "https://api.iconify.design/ph/currency-circle-dollar-fill.svg?color=%231f883d&width=256",
  "permissions": [],
  "window": {
    "style": "phone",
    "width": 420,
    "height": 720
  },
  "scripts": null,
  "state": {
    "rates_json": "",
    "rates_at": "",
    "result": "",
    "loading": false,
    "error": ""
  },
  "collections": {
    "scratch": {
      "schema": {
        "cost": {
          "type": "number"
        }
      }
    }
  }
}
