{
  "id": "sysmon-mem",
  "name": "Memory Monitor",
  "description": "menubar memory usage live + 60s history sparkline",
  "version": "0.1.0",
  "renderer": "web",
  "requires": [
    {
      "plugin": "sysinfo",
      "version": ">=1.0"
    }
  ],
  "permissions": [
    "system:read",
    "data:read",
    "data:write"
  ],
  "collections": {
    "metrics": {
      "storage": "memory",
      "schema": {
        "ts": {
          "type": "integer"
        },
        "mem_pct": {
          "type": "number"
        },
        "mem_used": {
          "type": "integer"
        },
        "mem_total": {
          "type": "integer"
        }
      }
    }
  },
  "jobs": [
    {
      "id": "collect",
      "trigger": {
        "kind": "interval",
        "ms": 1000
      },
      "while": "window_open",
      "handler": "collectMem"
    }
  ],
  "window": {
    "width": 320,
    "height": 200
  }
}
