{
  "id": "weight",
  "name": {
    "default": "Weight",
    "en": "Weight",
    "zh": "体重",
    "ja": "体重"
  },
  "description": {
    "default": "Daily weight log with line chart.",
    "en": "Daily weight log with line chart.",
    "zh": "每日体重打卡 + 折线趋势。",
    "ja": "毎日の体重ログと折れ線グラフ。"
  },
  "docs": "# Weight\n\n按天记体重，看趋势。简单数据 + Chart 组件 dogfood。\n\n## 模型\n\n- `entries` 表：{ date YYYY-MM-DD, weight number, unit \"kg\"|\"lb\", note string, created_at }\n- 同一天可多次录入（不去重）；Chart 按 date 升序连线\n\n## UI\n\n- 顶卡：DatePicker (default today) + NumberField + Input note → Add\n- Chart line：最近 90 天\n- 历史 DataList：倒序，每行 Delete\n",
  "version": "1.0.0",
  "renderer": "auto",
  "author": "agent-rt",
  "category": "utilities",
  "keywords": [
    "weight",
    "health",
    "tracker",
    "chart"
  ],
  "icon": "https://api.iconify.design/ph/scales-fill.svg?color=%2300a86b&width=256",
  "permissions": [
    "data:read",
    "data:write"
  ],
  "window": {
    "style": "phone",
    "width": 440,
    "height": 900
  },
  "collections": {
    "entries": {
      "schema": {
        "date": {
          "type": "string"
        },
        "weight": {
          "type": "number"
        },
        "unit": {
          "type": "string"
        },
        "note": {
          "type": "string"
        },
        "created_at": {
          "type": "number"
        }
      },
      "indexes": [
        "date",
        "created_at"
      ]
    }
  }
}
