{
  "id": "counter",
  "name": {
    "default": "Counter",
    "zh": "计数器",
    "ja": "カウンター"
  },
  "description": {
    "default": "A simple tap counter.",
    "zh": "简单的点击计数器。",
    "ja": "シンプルなタップカウンター。"
  },
  "version": "0.1.0",
  "renderer": "web",
  "default_locale": "en",
  "category": "productivity",
  "permissions": [],
  "state": {
    "count": 0
  },
  "window": {
    "style": "phone",
    "width": 360,
    "height": 360
  }
}
